Product Title,SKU #,UPC,Whole Sale Price Per Unit
WHOLESALE SCARF HANGERS - ASSORTED COLORS,SKU #1935502 ,,$3.21 
WHOLESALE JETSETTER FOLDABLE SUNGLASSES,SKU #1777670 ,UPC: 722950238493,$4.95 
WHOLESALE SCARF HANGER ORGANIZER / SPACE SAVER,SKU #1935504 ,,$3.21 
WHOLESALE STRIPED SHEER SCARVES - NEUTRAL COLORS,SKU #1933907 ,UPC: 722950271131,$2.10 
WHOLESALE LAVELLO FLEXISCARF VERSATILE RUFFLED SCARF,SKU #1946470 ,UPC: 722950275429,$2.58 
WHOLESALE LAVELLO FLEXISCARF VERSATILE RUFFLED SCARF - ASSORTED,SKU #1946468 ,UPC: 722950275412,$2.58 
WHOLESALE SIZZLE SHADES KIDS SUNGLASSES,SKU #1258279 ,UPC: 722950228272,$1.97 
WHOLESALE RAIN PONCHOS,SKU #1903939 ,UPC: 049392079812,$0.57 
WHOLESALE NEON RUBBER SUNGLASSES,SKU #1895082 ,UPC: 049392610428,$0.60 
WHOLESALE SEEVIX VALUE READERS ASSORTED STYLES & DIOPTERS,SKU #1917649 ,UPC: 030968030023,$0.81 
WHOLESALE NEON BANDANAS,SKU #1903837 ,UPC: 049392628409,$0.55 
WHOLESALE SOLARFLAIR VALUE SUNGLASSES ASSORTED,SKU #1917650 ,UPC: 030968025005,$0.89 
WHOLESALE RED BANDANAS,SKU #1903943 ,UPC: 049392680025,$0.55 
WHOLESALE BANDANAS - WHITE,SKU #1904803 ,UPC: 049392605691,$0.55 
WHOLESALE ASSORTED BANDANAS,SKU #2127689 ,UPC: 856434012030,$1.05 
WHOLESALE RAIN PONCHO - ONE SIZE FITS ALL,SKU #1875885 ,UPC: 097958007007,$0.95 
WHOLESALE AMERICAN FLAG PATTERN BANDANAS,SKU #1903536 ,UPC: 049392616833,$0.55 
"WHOLESALE 43"" TWO-FOLD UMBRELLA",SKU #2134164 ,UPC: 8276809005917,$2.99 
WHOLESALE STRAW SUN BONNET,SKU #1932249 ,UPC: 085754168527,$2.42 
WHOLESALE NEON PLASTIC VISORS,SKU #1776479 ,UPC: 049392606032,$0.37 
WHOLESALE FOAM VISORS,SKU #1776480 ,UPC: 049392611456,$0.38 
WHOLESALE READING GLASSES,SKU #678620 ,,$1.30 
WHOLESALE BULK MINI UMBRELLA,SKU #1266926 ,,$3.20 
WHOLESALE BULK FOLDING UMBRELLA,SKU #1982900 ,UPC: 856434014225,$3.79 
WHOLESALE FOLDING UMBRELLA,SKU #1933756 ,UPC: 097958050225,$2.59 
WHOLESALE CASUAL OUTFITTERS 10 PIECE SHAPEABLE HAT SET,SKU #432495 ,UPC: 024409942570,$10.70 
WHOLESALE FOSTER GRANT SUNGLASSES,SKU #1940296 ,,$1.50 
WHOLESALE ALL-WEATHER WATERPROOF PONCHO,SKU #704158 ,UPC: 024409981203,
WHOLESALE WOVEN COWBOY FASHION HAT WITH NECK CORD,SKU #1949341 ,UPC: 731015232260,$2.25 
WHOLESALE KID'S POLAR FLEECE GLOVES,SKU #1981308 ,UPC: 856434012597,$1.45 
WHOLESALE MEN'S POLAR FLEECE GLOVES,SKU #1981305 ,UPC: 856434001218,$1.45 
WHOLESALE WOMEN'S POLAR FLEECE GLOVES,SKU #1981303 ,UPC: 856434012603,$1.45 
WHOLESALE DEZIGNER ALTERNATIVES BULK SUNGLASSES,SKU #673510 ,,$1.86 
WHOLESALE LARGE STRAW HAT LIFEGUARD STYLE 20 INCH,SKU #1997873 ,,$5.20 
WHOLESALE ASSORTED SUNGLASSES,SKU #49895 ,,$0.95 
WHOLESALE RAINCOAT WITH POCKET,SKU #102367 ,,$0.60 
WHOLESALE BLACK & WHITE HAIR BANDS SET,SKU #113636 ,UPC: 731015054589,$0.87 
WHOLESALE LADY'S WOVEN SUN HAT,SKU #1776474 ,UPC: 049392106228,$2.43 
WHOLESALE CLOSEOUT FLORAL PRINTED UMBRELLAS,SKU #1782145 ,,$3.15 
WHOLESALE DIAMOND PLATE ASSORTED COTTON SKULL CAPS,SKU #704180 ,UPC: 024409937965,$1.91 
"WHOLESALE ALL-WEATHER 24 PIECE 42"" UMBRELLAS IN COUNTERTOP DISPLAY",SKU #378436 ,UPC: 024409056994,$3.21 
WHOLESALE NATURAL STRAW FEDORA HAT,SKU #1917157 ,,$2.35 
WHOLESALE PRINT SCARVES,SKU #673527 ,,$0.90 
WHOLESALE ADULT MAGIC STRETCH GLOVES,SKU #183006 ,UPC: 701953047035,$0.78 
WHOLESALE BROWN PLAIN BELT - ASSORTED SIZES,SKU #1793256 ,,$1.77 
WHOLESALE HEAT FACTORY MINI HAND WARMER,SKU #915540 ,UPC: 037137195323,$1.15 
WHOLESALE OPTI-KA-ZOO KIDS SUNGLASSES,SKU #1258278 ,UPC: 722950203767,$1.98 
WHOLESALE LADIES STRAW HAT WITH RIBBON,SKU #1940264 ,UPC: 085754168497,$1.67 
WHOLESALE NYLON PLAID FOLDING UMBRELLA,SKU #208211 ,UPC: 731015054299,$3.91 
WHOLESALE WOMAN'S SUMMER HAT WITH POLKA DOT BOW,SKU #1863346 ,,$1.75 
WHOLESALE MENS CAMOUFLAGE BUCKET HAT,SKU #1917232 ,,$1.96 
WHOLESALE READING GLASSES - MENS,SKU #681720 ,,$1.30 
WHOLESALE TRANSLUCENT READING GLASSES COUNTERTOP DISPLAY,SKU #789960 ,UPC: 731015162437,$1.06 
WHOLESALE PLAIN ASSORTED COLOR FEDORA HAT,SKU #1875521 ,,$2.64 
WHOLESALE CASUAL OUTFITTERS ASSORTED WOMEN'S' FLOPPY SUN HATS,SKU #1224940 ,UPC: 024409975974,$4.90 
WHOLESALE CREATIVE COLORS ADULT RAIN PONCHO,SKU #1996223 ,UPC: 619342104071,$0.67 
WHOLESALE LOLLIBANDS HAIRBANDS,SKU #1221563 ,UPC: 722950227244,$1.28 
WHOLESALE REBEL SPORT POLARIZED SUNGLASSES,SKU #1893841 ,,$4.90 
WHOLESALE METAL FRAME SUNGLASSES,SKU #790624 ,,$0.85 
WHOLESALE SUNGLASSES,SKU #790600 ,,$0.86 
WHOLESALE READING GLASSES,SKU #49897 ,,$1.05 
NEW! WHOLESALE NARROW FRAMED READING GLASSES,SKU #2184357 ,UPC: 739042012961,$1.01 
WHOLESALE BLACK BELT - ASSORTED SIZES,SKU #1793257 ,,$2.13 
WHOLESALE STRAW COWBOY HATS - ASSORTED COLORS,SKU #1034157 ,,$6.03 
WHOLESALE FISHING/SAFARI STYLE HATS,SKU #1980761 ,,$2.79 
WHOLESALE BLACK FELT FEDORA HAT,SKU #1776823 ,,$2.71 
WHOLESALE STRAW GAMBLER HAT,SKU #1776475 ,,$2.71 
WHOLESALE WEATHERZONE JUMBO GOLF UMBRELLAS,SKU #1893860 ,,$6.90 
WHOLESALE AVIATOR SUNGLASSES,SKU #1904187 ,UPC: 049392620205,$1.03 
WHOLESALE WESTERN COWBOY HAT - ASSORTED COLOR,SKU #1793286 ,,$3.44 
WHOLESALE 16 HOUR BODY WARMERS,SKU #1944833 ,UPC: 616983315033,$1.10 
WHOLESALE ACRYLIC FRAME PAISLY LOOK READERS GLASSES,SKU #682887 ,,$1.14 
WHOLESALE RAINBOW FEDORA HAT,SKU #1875514 ,,$2.95 
WHOLESALE UMBRELLA - FOLDED,SKU #1341001 ,,$3.25 
WHOLESALE KNIT MEN'S GLOVES,SKU #2132480 ,UPC: 701953017908,$0.73 
"WHOLESALE CHILDREN'S WINTER GLOVES (5""- 5.5"")",SKU #1931135 ,,$0.83 
WHOLESALE 507 FASHION KNIT GLOVES IN ASSORTED COLORS,SKU #1875277 ,,$1.09 
WHOLESALE KNIT SKI CAP - ASSORTED COLORS,SKU #2132481 ,UPC: 701953082913,$0.83 
WHOLESALE MEN'S WINTER HAT - ASSORTED COLORS,SKU #2124670 ,,$1.20 
WHOLESALE ADULT KNIT WINTER HATS,SKU #49735 ,,$1.25 
WHOLESALE DIAMOND PLATE ASSORTED COTTON SKULL CAP SET,SKU #1224864 ,UPC: 024409981876,$1.53 
WHOLESALE PRISMATIC METAL READERS GLASSES,SKU #1265299 ,UPC: 030968033017,$2.42 
WHOLESALE BOONIE HATS COWBOY STYLE FISHING HATS,SKU #1987714 ,,$2.85 
WHOLESALE RAINWORTHY COMPACT UMBRELLAS,SKU #339848 ,,$4.00 
WHOLESALE WEATHER STATION ADULT PONCHOS,SKU #1893853 ,,$5.09 
WHOLESALE SUMMER HUNTING FISHING HAT WITH NECK COVER,SKU #1894518 ,,$6.47 
WHOLESALE BANDANAS - BLACK,SKU #1904798 ,UPC: 049392605615,$0.55 
WHOLESALE BULK LADIES HANDKERCHIEFS- FLORAL- 3 PACK,SKU #1793203 ,UPC: 693315662652,$1.21 
WHOLESALE DESIGNER SCARVES BY LAVELLO,SKU #1471700 ,UPC: 722950240007,$2.52 
WHOLESALE FLOPPY TOPS KIDS REVERSABLE SUN HAT,SKU #1221134 ,UPC: 722950220474,$5.54 
WHOLESALE CHILDRENS PONYO,SKU #676537 ,,$0.77 
WHOLESALE HAIR SCRUNCHIES,SKU #675276 ,,$0.85 
WHOLESALE CHILDRENS SUNGLASSES,SKU #790644 ,,$0.86 
WHOLESALE OVERSIZED BLACK BANDANA,SKU #1944670 ,UPC: 016318207932,$0.76 
WHOLESALE HANDKERCHIEF - WHITE,SKU #678623 ,,$1.25 
WHOLESALE RAIN PONCHOS FOR ADULTS,SKU #678481 ,,$1.50 
WHOLESALE LIGHT WEIGHT SCARVES ASSORTED STYLES,SKU #1194124 ,,$1.73 
WHOLESALE ST. PAT BASEBALL HAT,SKU #2132788 ,UPC: 889070220477,$2.02 
WHOLESALE CLOSEOUT MENS FLEECE GLOVES,SKU #299328 ,UPC: 039753602025,$1.38 
WHOLESALE WOMEN'S MEDIUM LENS THICK FRAME SUNGLASSES,SKU #1940905 ,,$5.18 
"WHOLESALE ALL-WEATHER 42"" PINK AND CLEAR DOME UMBRELLA",SKU #1224955 ,UPC: 024409987250,
WHOLESALE CASUAL OUTFITTERS COWBOY HAT SET,SKU #1993292 ,UPC: 024409513664,$9.40 
WHOLESALE CHILDREN'S JEWELRY/HAIR ACCESSORY DISPLAY,SKU #1082372 ,UPC: 613153996115,$0.85 
WHOLESALE BLACK BOBBY PINS WITH SOFT TIPS,SKU #215569 ,UPC: 731015010622,$0.87 
WHOLESALE CLOSEOUT HAIR ACCESSORY COUNTER TOP DISPLAY,SKU #1335034 ,UPC: 731015185092,$1.59 
WHOLESALE FUNKY TIE-DYED BANDANA,SKU #531479 ,UPC: 034689607618,$2.09 
WHOLESALE PINK BANDANA,SKU #1439864 ,UPC: 097138648396,$1.75 
WHOLESALE PLUSH ANIMAL HATS 12 DIFFERENT ANIMALS ASSORTED,SKU #1226444 ,,$6.00 
WHOLESALE CAMOUFLAGE PRINT BANDANAS,SKU #1903592 ,UPC: 049392621073,$0.55 
WHOLESALE CLOSEOUT AS SEEN ON TV 3 PACK SNAP-ON FEATHERS EXTENSIONS,SKU #1261533 ,,$1.00 
WHOLESALE GLITTER TOP HATS,SKU #1776826 ,UPC: 049392625187,$1.32 
WHOLESALE KIDS FLORAL BUCKET SUMMER HAT WITH BOW,SKU #1917190 ,,$0.99 
WHOLESALE PLAIN COLOR KIDS SUMMER HAT,SKU #1875811 ,,$1.96 
WHOLESALE KIDZ EYEWEAR CHILDREN'S SUNGLASSES,SKU #1893837 ,,$1.80 
WHOLESALE UNITED STATES VETERAN HAT,SKU #1796983 ,,$3.17 
WHOLESALE MEN SUMMER HATS - ASSORTED COLOR,SKU #1917237 ,,$3.76 
WHOLESALE ASSORTED COLOR BRAIDED HAIR PIECES,SKU #1776282 ,UPC: 049392013670,$0.15 
WHOLESALE CHILDRENS HAIR ACCESSORIES,SKU #675274 ,,$0.86 
NEW! WHOLESALE SILKY SMOOTH ASSORTED WOMEN'S SCARF BANDANAS,SKU #2182154 ,,$0.86 
WHOLESALE ADULT/YOUTH MAGIC GLOVES BLACK,SKU #1226718 ,,$0.95 
WHOLESALE CLOSEOUT BANDANAS - ASSORTED COLORS,SKU #1949802 ,,$0.95 
WHOLESALE READING GLASSES METAL FRAMES 1.0-3.5 POWER,SKU #1183613 ,,$1.41 
WHOLESALE CHILDREN'S HOODED RAIN PONCHO,SKU #112577 ,UPC: 731015052325,$0.98 
WHOLESALE UMBRELLA HATS - MIXED COLORS,SKU #993063 ,,$1.55 
WHOLESALE CLOSEOUT READING GLASSES ASSORTMENT,SKU #915434 ,,$1.72 
WHOLESALE TIE DYE COLOR ASSORTMENT LIGHT SCARF,SKU #1194122 ,,$1.73 
WHOLESALE LIGHT WEIGHT SCARVES - ASSORTED COLORS AND STYLES,SKU #1034149 ,,$1.73 
WHOLESALE SOLID BLACK SUSPENDERS,SKU #1785655 ,,$1.76 
WHOLESALE PINK CAMO BANDANA,SKU #531477 ,UPC: 034689160205,$1.79 
WHOLESALE UNISEX WINTER KNIT CAPS,SKU #993119 ,,$2.00 
WHOLESALE RAINBOW COLORED SUSPENDERS,SKU #1785676 ,,$2.45 
WHOLESALE DEMI FRAME READERS GLASSES WITH CASES AND DISPLAY,SKU #1893844 ,,$2.41 
WHOLESALE BASEBALL HATS,SKU #683917 ,,$3.19 
WHOLESALE UMBRELLA- PLAID,SKU #1819404 ,,$3.25 
WHOLESALE ADJUSTABLE BASEBALL HATS CAPS REBEL,SKU #697766 ,,$3.45 
WHOLESALE STRAW COWBOY HAT,SKU #1821088 ,,$3.45 
WHOLESALE FIRE DEPARTMENT BASEBALL HAT,SKU #782360 ,,$3.45 
WHOLESALE OPTISPEX MAGNIFYING NECKLACE GLASSES,SKU #1945541 ,UPC: 722950276969,$3.65 
WHOLESALE PARK RANGER HAT,SKU #1895850 ,UPC: 085754162426,$4.45 
"WHOLESALE ALL-WEATHER 12 PIECE 40"" UMBRELLAS IN COUNTERTOP DISPLAY",SKU #704197 ,UPC: 024409949739,$4.05 
WHOLESALE CLOSEOUT LONDON FOG MEN'S GREY NEWSBOY CAP,SKU #2130632 ,,$6.00 
WHOLESALE YUPOONG BRUSHED COTTON TWILL 6-PANEL MID-PROFILE SANDWICH CAP,SKU #2021872 ,,
"WHOLESALE ALL-WEATHER 48"" AUTO-OPEN UMBRELLA",SKU #1224959 ,UPC: 024409928307,
WHOLESALE SUNLILY ROLL-N-GO SUN HAT,SKU #2128836 ,UPC: 722950288818,$9.75 
WHOLESALE SUNLILY BALI WRAP - ASSORTED COLORS,SKU #1949553 ,UPC: 722950275610,$9.90 
WHOLESALE ADAMS 6-PANEL UV LOW-PROFILE CAP WITH ELONGATED BILL AND NECK CAPE,SKU #2020627 ,,
WHOLESALE EYEGLASS REPAIR KIT COUNTERTOP DISPLAY,SKU #1944575 ,UPC: 781274323070,
WHOLESALE GIRL'S CUTE ASSORTED ANIMAL SCARF/EAR MUFF SET,SKU #1930542 ,,$5.15 
WHOLESALE IMPRESS 3-PIECE BLACK HAIR NETS (144-CT CASE),SKU #1870435 ,,$0.87 
WHOLESALE TINKER BELL GIRL'S HAIR DISPLAY ASSORTMENT,SKU #1082247 ,UPC: 613153993008,$0.88 
WHOLESALE CHILDREN'S KNIT MAGIC GLOVES,SKU #2132474 ,UPC: 701953048308,$0.70 
WHOLESALE ELASTIC HAIR BANDS COUNTERTOP DISPLAY,SKU #1278740 ,UPC: 731015166459,$0.80 
WHOLESALE POWER CLUB BLACK BEANIE HATS,SKU #903402 ,UPC: 063910180019,$1.10 
NEW! WHOLESALE METAL FRAME READING GLASSES DISPLAY,SKU #2182723 ,UPC: 758266004125,$1.10 
WHOLESALE SHEER SCARF,SKU #2124672 ,,$1.30 
WHOLESALE MEN'S HAT & GLOVES SET - 3 ASSORTED COLORS,SKU #2124669 ,,$1.40 
WHOLESALE USA EAGLE BIKE EMBROIDERED BANDANA/SKULL CAP,SKU #2123636 ,,$1.70 
WHOLESALE BORN IN THE USA EMBROIDERED BANDANA/SKULL CAP,SKU #2123635 ,,$1.70 
WHOLESALE CASUAL OUTFITTERS PRINTED TUBE HEADBAND,SKU #1797316 ,UPC: 024409981821,$1.36 
WHOLESALE VENTURE READERS,SKU #1265294 ,UPC: 030968033369,$1.62 
WHOLESALE JOCKEY STRUCTURED BASEBALL CAP/HAT - KHAKI/BLACK,SKU #1995935 ,,$1.89 
WHOLESALE ZEBRA PRINT SUNGLASSES WITH BOW,SKU #1470236 ,UPC: 097138775344,$1.97 
WHOLESALE RIBBONZ ELASTIC HAIR TIE/BRACELET 5-PACK,SKU #2132973 ,,$1.66 
WHOLESALE SAFARI READERS,SKU #1265296 ,UPC: 030968033338,$1.62 
WHOLESALE WOMEN'S WOVEN FASHION HAT,SKU #1756429 ,UPC: 731015189021,$1.36 
WHOLESALE BIG ACCESSORIES 6-PANEL STRUCTURED TRUCKER CAP,SKU #2020738 ,,
WHOLESALE LAVELLO INFINITY SCARF,SKU #1917080 ,UPC: 722950269893,$2.80 
WHOLESALE HOMETOWN CLASSICS INFINITY SCARF,SKU #1941156 ,UPC: 722950271827,$2.80 
"WHOLESALE BOSS SNAP BACK HAT, BASEBALL CAP",SKU #1860544 ,,$3.03 
WHOLESALE BRITT'S KNITS HEAD WARMERS,SKU #1925817 ,UPC: 722950265482,$3.15 
WHOLESALE 100 PIECE GIRL'S HAIR ACCESSORY MEGA PACKS,SKU #2132844 ,,$2.82 
WHOLESALE WOMAN NEWSBOY HATS - ASSORTED COLORS,SKU #1935206 ,,$3.45 
WHOLESALE BIG ACCESSORIES 6-PANEL BRUSHED TWILL UNSTRUCTURED CAP,SKU #2021755 ,,
NEW! WHOLESALE YOUTH FOOTBALL BELT - BLACK,SKU #2256587 ,,
NEW! WHOLESALE ADULT FOOTBALL BELT - BLACK,SKU #2199994 ,,
WHOLESALE WOMEN'S FEDORA HATS WITH FLOWER BANDS,SKU #1895260 ,,$3.95 
WHOLESALE GIRLS MULTI ZIG-ZAG HAT & GLOVES SET,SKU #2127189 ,UPC: 891388016444,$4.00 
WHOLESALE BOYS SLEEPY MONSTER HAT & GLOVES SET,SKU #2127176 ,UPC: 891388016550,$4.00 
WHOLESALE PIZZA HAT,SKU #1776531 ,,$4.23 
WHOLESALE BIG ACCESSORIES COTTON TWILL VISOR,SKU #2022364 ,,
WHOLESALE ANVIL SOLID BRUSHED TWILL CAP,SKU #2021975 ,,
WHOLESALE WEATHER STATION YOUTH PONCHOS,SKU #1893854 ,,$4.75 
WHOLESALE TEAM 365 STRIPED POM BEANIE,SKU #2040319 ,,
WHOLESALE ADAMS ACE VAT-DYED TWILL VISOR,SKU #2022231 ,,
"WHOLESALE RAINWORTHY 60"" GOLF UMBRELLAS",SKU #315709 ,UPC: 607656000301,$7.10 
WHOLESALE STRAW COWBOY HAT WITH MEDALLION,SKU #1980816 ,,$7.25 
WHOLESALE AUTHENTIC PIGMENT PIGMENT-DYED RAW-EDGE PATCH BASEBALL CAP,SKU #2020640 ,,
WHOLESALE CLASSIC SAFARI DIGITAL CAMO RAIN JACKET - MEDIUM/LARGE,SKU #1797521 ,UPC: 024409488801,
WHOLESALE CLASSIC SAFARI DIGITAL CAMO RAIN JACKET - XL/2X,SKU #1797514 ,UPC: 024409488825,
WHOLESALE KIDS' PVC/RUBBER RAIN BOOTS (SIZE 5-10),SKU #1934201 ,UPC: 125522000557,$9.40 
WHOLESALE FASHION SPORT SUNGLASSES,SKU #376362 ,UPC: 758266004453,$2.40 
